{
 "id": "bundle1_v1",
 "title": "Bundle 1: Architecture Conditional Selection (Milestone A)",
 "follow_on": "fo_bundle1_conditional_selection",
 "trigger": "T_BUNDLE1",
 "attempt": 2,
 "execution_key": "d45eda8e144c71eae9f5ebf0d1c1a560af20903571c60bbcdb605e361b68a148",
 "claim": {
  "utc": "2026-09-26T19:50:17+00:00",
  "dependency_state_hash": "338530240c55f4d1ac2391088f4bdcdec62c6ab91b331ef8821fc5d96d2f0fc8",
  "source": "docs/orchestration/trigger_ledger_v2.jsonl",
  "prerequisite_identities_match_pins": true
 },
 "base_commit": "1a1f7e4b7767d41ca99e20641c11dc4d3cafcda7",
 "prepared": "2026-09-26",
 "status": "DRAFT_FOR_OWNER_REVIEW",
 "architectures": [
  "hall_only",
  "rf_hall",
  "ecr_hall"
 ],
 "boundary_version": "bus_power_boundary_v1",
 "what_it_is": "A synthesis of the verified T_BUNDLE1 prerequisites into the owner's Milestone-A form: admissibility of the three-architecture comparison on bus_power_boundary_v1, hard-gate status, and one outcome under a PROPOSED decision rule.",
 "what_it_is_not": "Not a decision, not a ranking, not a prediction. It adds no physics, source or number: every value is read from a pinned input. No Hall closure, screening candidate or withdrawn 0-D Hall number is used; nothing is wired into archengine; no golden moves.",
 "milestones": {
  "supports": [
   "A"
  ],
  "A": "Milestone-A outcome in the owner's vocabulary, with the blocking fields, lanes and measurements.",
  "to_reach_B": [
   "an admitted Hall transport closure and design Hall maps per member (T_ABSOLUTE_COMPARISON)",
   "chemistry for the delivered feed (O/O2 absent; N2 set scoped to P5-N2 validation)",
   "common-boundary ledgers with evidenced loads and efficiencies (T_AUX_BUS)",
   "the feed design baseline (DI-1) and the Vyovrinda Hall design point (DI-2)",
   "measured pre-ionizer delivered-ion cost, eta_t and response (rf_hall, ecr_hall); DM-2 for hall_only",
   "owner approval of the lane-24 matrix (DRAFT_PENDING_OWNER) and of this decision rule",
   "second-lens verification of any single-lens-v1 lane before it is decisive"
  ],
  "to_reach_C": [
   "mass, thermal, life, start-up and cathode closure on the same boundary (T_VETO_LAYER, lane_19_cathode_integration)",
   "every TBD threshold and open lane-24 reading resolved (OD1-OD14)",
   "integrated mission closure"
  ]
 },
 "inputs": [
  {
   "lane": "lane_07_rf_evidence",
   "title": "RF source evidence audit",
   "role": "prerequisite",
   "commit": "336d548042359f8559d0bf50a409a976c0158fc2",
   "verification_protocol": "two-lens-v2",
   "protocol_source": "docs/orchestration/lane_registry_v1.json lanes[lane_07_rf_evidence].verification_protocol",
   "protocol_notes": [],
   "decisive_for_B_or_C_allowed": true,
   "files": [
    {
     "path": "docs/evidence/rf_source/rf_evidence_matrix.json",
     "sha256": "5f6d4e0ede8b2e21e45b740c28ac9320e7ddd6cfd70ef05012f85712ae0ac8e8"
    },
    {
     "path": "docs/evidence/rf_source/RF_SOURCE_EVIDENCE.md",
     "sha256": "88fb9015e7b864796b13f6d1485d0bf1273f0660035299b032fa414904fb1e15"
    }
   ]
  },
  {
   "lane": "lane_08_ecr_evidence",
   "title": "ECR source evidence audit",
   "role": "prerequisite",
   "commit": "a85fd592618cb15a02f14123659a0698db90df19",
   "verification_protocol": "two-lens-v2",
   "protocol_source": "docs/orchestration/lane_registry_v1.json lanes[lane_08_ecr_evidence].verification_protocol",
   "protocol_notes": [],
   "decisive_for_B_or_C_allowed": true,
   "files": [
    {
     "path": "docs/evidence/ecr_source/ecr_evidence_matrix.json",
     "sha256": "4a65dbeec34f16f048fa515ced3bb959c02a981113e25da89e8bb844337fec88"
    },
    {
     "path": "docs/evidence/ecr_source/ECR_SOURCE_EVIDENCE.md",
     "sha256": "b543437f216335fd972de560345864c172472a12e3522566771413126677f440"
    }
   ]
  },
  {
   "lane": "lane_09_hall_sustainment",
   "title": "Hall-only sustainment evidence",
   "role": "prerequisite",
   "commit": "ac7970917fd0e88c065d75406ea90c1d7ebaca7b",
   "verification_protocol": "two-lens-v2",
   "protocol_source": "docs/orchestration/lane_registry_v1.json lanes[lane_09_hall_sustainment].verification_protocol",
   "protocol_notes": [],
   "decisive_for_B_or_C_allowed": true,
   "files": [
    {
     "path": "docs/evidence/hall_sustainment/hall_sustainment_matrix.json",
     "sha256": "248aef28cfe6ffff90d9ee6d43c388488140547e1ce5659975ce30ca77f415b4"
    },
    {
     "path": "docs/evidence/hall_sustainment/HALL_SUSTAINMENT_EVIDENCE.md",
     "sha256": "f9674b60b2a2852e6b960e227a95626a78096d28eb698b9237bc9a419fcf7c01"
    }
   ]
  },
  {
   "lane": "lane_16_feed_envelope",
   "title": "Thruster feed envelope",
   "role": "prerequisite",
   "commit": "ab27dcc449690606defa09af59725c0ad2eeaab4",
   "verification_protocol": "two-lens-v2",
   "protocol_source": "docs/orchestration/lane_registry_v1.json lanes[lane_16_feed_envelope].verification_protocol",
   "protocol_notes": [],
   "decisive_for_B_or_C_allowed": true,
   "files": [
    {
     "path": "docs/architecture_comparison/feed_envelope/feed_envelope_v1.json",
     "sha256": "ada3ee720b1b8d60526d3b092492589f62a4144112845b4d813dbc8dc7d5ca02"
    },
    {
     "path": "docs/architecture_comparison/feed_envelope/FEED_ENVELOPE.md",
     "sha256": "e3f9f1fc5dd57b6569065d2750842dd9792dd74ae8d483b271e7d10e4d3f262d"
    }
   ]
  },
  {
   "lane": "lane_17_hall_reference",
   "title": "Common Hall accelerator reference",
   "role": "prerequisite",
   "commit": "91ebd8a4017eb8609804846603063a25c41405c1",
   "verification_protocol": "two-lens-v2",
   "protocol_source": "docs/orchestration/lane_registry_v1.json lanes[lane_17_hall_reference].verification_protocol",
   "protocol_notes": [
    "repairs registered (wf_78429369-deb); state from the latest repair run"
   ],
   "decisive_for_B_or_C_allowed": true,
   "files": [
    {
     "path": "docs/architecture_comparison/hall_reference/hall_reference_v1.json",
     "sha256": "c60e0adfbef2c6f8dddaa9b7e89cea6b0ce760d3c9777dff5a47c2bfda7cb2e6"
    },
    {
     "path": "docs/architecture_comparison/hall_reference/HALL_ACCELERATOR_REFERENCE.md",
     "sha256": "6d92cbe6ed8758d94fb428f5bd71c3f5a6466834f346a43e8a51e81b5eaa0de4"
    }
   ]
  },
  {
   "lane": "lane_18_interstage",
   "title": "Pre-ionizer -> Hall interstage physics",
   "role": "prerequisite",
   "commit": "870514285c087382b21812c65bd9db196a5a985f",
   "verification_protocol": "two-lens-v2",
   "protocol_source": "docs/orchestration/lane_registry_v1.json lanes[lane_18_interstage].verification_protocol",
   "protocol_notes": [],
   "decisive_for_B_or_C_allowed": true,
   "files": [
    {
     "path": "abep_sim/interstage.py",
     "sha256": "bc4b9987a832209d1417f6646d2a44c72b8d79bac18f896089647bcd1ed93174"
    },
    {
     "path": "docs/architecture_comparison/interstage/INTERSTAGE_MODEL.md",
     "sha256": "2a08e8045d1cb61a121e84dc9f7bba268a1ec7b66476057d9093b4e044f6d616"
    }
   ]
  },
  {
   "lane": "lane_20_ppu_magnet",
   "title": "PPU + magnet electrical closure",
   "role": "prerequisite",
   "commit": "f7c226848d85fedb70c03bae9971be3b2bbde1fe",
   "verification_protocol": "two-lens-v2",
   "protocol_source": "docs/orchestration/lane_registry_v1.json lanes[lane_20_ppu_magnet].verification_protocol",
   "protocol_notes": [],
   "decisive_for_B_or_C_allowed": true,
   "files": [
    {
     "path": "abep_sim/magnet_power.py",
     "sha256": "adf2905d90b7dd17b59071759d0a62b245fa065b0c3375c74df4e3476b7bb523"
    },
    {
     "path": "docs/architecture_comparison/electrical_closure/electrical_closure_data_v1.json",
     "sha256": "d56f700198a64a919d736c8659b6e0aaaa01cd56521885772d2f5a40de374501"
    },
    {
     "path": "docs/architecture_comparison/electrical_closure/ELECTRICAL_CLOSURE.md",
     "sha256": "661ff1c3b783edf5b32c48a638f9b1931046af68bfef87e9ce9f17de01264aaa"
    }
   ]
  },
  {
   "lane": "lane_24_hard_gates",
   "title": "Architecture hard-gate matrix + evaluator",
   "role": "prerequisite",
   "commit": "08b9f9bf32a0b34142338b2003f2b2cf02ecaacc",
   "verification_protocol": "two-lens-v2",
   "protocol_source": "docs/orchestration/lane_registry_v1.json lanes[lane_24_hard_gates].verification_protocol",
   "protocol_notes": [
    "verified_pin at commit 08b9f9bf32a0b34142338b2003f2b2cf02ecaacc"
   ],
   "decisive_for_B_or_C_allowed": true,
   "files": [
    {
     "path": "abep_sim/hard_gates.py",
     "sha256": "a36fe3c9065291f0fe5be3f17e179d5b691f00c013f7f8ef299fa89db896dda8"
    },
    {
     "path": "docs/architecture_comparison/hard_gates/hard_gate_matrix_v1.json",
     "sha256": "7d77d2831214f3f3d96c8254ea43643ada15e7d1ce0685dec86a65eb79a8f65f"
    },
    {
     "path": "docs/architecture_comparison/hard_gates/hard_gate_status_v1.json",
     "sha256": "2c82b3277067b22c85eabd25539b18101f429e6d34ee698d2f5d6e183aa44527"
    },
    {
     "path": "docs/architecture_comparison/hard_gates/evidence_register_v1.json",
     "sha256": "45dfbfb311441aeb7c9c58f5dbb9ffb39c28fa448b85de552c37e8268ff94a3d"
    },
    {
     "path": "docs/architecture_comparison/hard_gates/HARD_GATES.md",
     "sha256": "536d8d9d6d5ea6238cc8bfd9c7c22f6637ebf6102c85b4d326625c1019dae0b2"
    }
   ]
  },
  {
   "lane": "lane_28_break_even",
   "title": "Break-even surfaces (power, utilization, mass, life)",
   "role": "prerequisite",
   "commit": "2ad4c463d7a7bd7b983e2de30f8fb34d8cac92fa",
   "verification_protocol": "two-lens-v2",
   "protocol_source": "docs/orchestration/lane_registry_v1.json lanes[lane_28_break_even].verification_protocol",
   "protocol_notes": [],
   "decisive_for_B_or_C_allowed": true,
   "files": [
    {
     "path": "abep_sim/breakeven.py",
     "sha256": "fad317b74c3f1359d849c62a7b487f2e26d8ccb3be05a35c15b515ea6d948767"
    },
    {
     "path": "docs/architecture_comparison/breakeven/breakeven_surfaces_v1.json",
     "sha256": "577fa11b62ee5d9c04f0d9f483d93962062f5fd40bb7aefd411eb9c0764985bc"
    },
    {
     "path": "docs/architecture_comparison/breakeven/BREAKEVEN_DERIVATION.md",